comment,category,tag,keywords
商品の場所がわからず店員さんに聞くといつも感じ良く教えて下さるので感謝しています 洗剤など掃除用品や台所用品などよく買いますがスーパーやドラッグストアより安いのでとても助かっています 。,サービス・設備,デイリーグッズ,"['商品の場所', '店員さん', '感じ良い', '洗剤', '掃除用品', '台所用品', '安い', '助かる']"
キリンアリカリイオン水安くしてください 。,商品,ヘルスケア,"['キリンアリカリイオン水', '安く']"
たまに商品の場所が変わってわからなくなる時がある 場所が変わったら表示して欲しい 。,サービス・設備,商品陳列,"['商品の場所', '変わる', '表示']"
レジスタッフさん、以前よりとてもいいです。,サービス・設備,接客態度,"['レジスタッフ', 'いい']"
ボタニスト系商品を安くして下さい 。,商品,ヘルスケア,"['ボタニスト', '商品', '安く']"
丁寧 majicaの使い方に手間取っていたらサポートもしてくれて助かった。,サービス・設備,商品知識,"['majica', '使い方', '手間取る', 'サポート', '助かる']"
レジの男性が 丁寧にチャージしたら2年有効 と説明してくれました ありがとうございました 。,サービス・設備,接客態度,"['レジ', '男性', '丁寧', 'チャージ', '2年有効']"
どこに何があるかもう少しわかりやすくしてほしい。,サービス・設備,店内レイアウト,['わかりやすい']
オープン当初は、格安で買える食材かあったのですが、今は全然少ないです 。,商品,デイリー,"['オープン当初', '格安', '食材']"
パン売り場のパンの種類をふやしてほしいです バケットをおいてください 。,商品,デイリー,"['パン', '売り場', '種類', 'ふやす', 'バケット']"
缶ビールを安くしてほしい。,商品,デイリー,"['缶ビール', '安く']"
会員限定値引きの値札が見にくいものが多かったです 。,サービス・設備,店内レイアウト,"['会員限定値引き', '値札', '見にくい']"
レジのTTさんは丁寧で、空いてたらラッキー！と思って並びます 。,サービス・設備,レジ処理の速度,"['丁寧', '空いてる', 'ラッキー']"
土日レジの混雑がきになる。,サービス・設備,レジ処理の速度,"['土日', 'レジ', '混雑']"
スナック菓子のポテトチップスが高いので安くしてほしい。,商品,フード＆ドリンク,"['スナック菓子', 'ポテトチップス', '高い', '安く']"
以前、六本木店でクリスマスツリーを購入したが、ツリーの幹や枝が折れていて、使い物にならなかった 残念！。,商品,ホームインテリア,"['クリスマスツリー', '折れている']"
10時過ぎに来店平日だからなのか食肉コースは品数が少なく通路には箱が山積みいつもはこんな事なかったから今日は残念な感じでした。,商品,フード＆ドリンク,"['来店', '平日', '食肉コース', '品数', '通路', '箱', '山積み', '残念']"
核家族のため、豚肉や鶏肉など少量パック(50〜100ｇ位の使い切りサイズ位の量)の商品を、毎回店員さんにお願いしなくても良いように店側で店頭に置いて欲しい 。,商品,デイリー,"['核家族', '豚肉', '鶏肉', '少量パック', '使い切りサイズ']"
もう少し 障害者に 優しく できる まる買い物が できるようにしてください 。,サービス・設備,ハンディキャップ対応,"['障害者', '優しく', 'まる買い物']"
花屋横の階段に2階にあがってる時に踊り場の壁にとても大きい蜘蛛がいてビックリしました 。,サービス・設備,店内の清潔度,"['蜘蛛', 'ビックリ']"
リニューアルして店の中が明るくなって、商品がゴチャゴチャしてなくて通路も広く買い物しやすくなったと感じました 。,サービス・設備,店内レイアウト,"['リニューアル', '明るい', 'ゴチャゴチャ', '通路', '広い', '買い物']"
シングルのトイレットペーパーを格安でお願いします。,商品,デイリー,"['トイレットペーパー', '格安']"
本を置いて下さい。,商品,ホームインテリア,['本']
日本のお菓子だけは一階にしてほしい。,商品,デイリー,"['お菓子', '一階']"
いいねっ！。,商品,商品知識,['いいね']
各レジ並びだと、前の人にアクシデントがあると並び続けなければならなくて、どんよりする事がたまにある 。,サービス・設備,レジ処理の速度,"['レジ', '並び', 'アクシデント']"
お手洗いは掃除はされているのですが、おそらく古いため、便器の周りの床がジワッと濡れていたり、何となく汚いなという感じがします 綺麗になって欲しいです 。,サービス・設備,トイレ設備,"['お手洗い', '掃除', '床', '濡れ', '汚い']"
名前は分かりませんが、常連で顔を覚えてもらっていて、とても丁寧な接客です 。,サービス・設備,接客態度,"['常連', '顔を覚えてもらっている', '丁寧な接客']"
レジ打ちの若い男性の態度が、あまりにもぶっきらぼうで、声も小さく聞き取り辛くて最悪でした クーポン対象の商品も、上限数がまだまだ沢山あったにも関わらず、棚に一つも陳列されていなくて、店員さんに確認したかったので、10分程探しましたが、誰も売り場にはいませんでした 久しぶりに嫌な気持ちで店を出ました 。,サービス・設備,接客態度,"['レジ打ち', '若い男性', '態度', '声', '聞き取り辛い', '最悪']"
フライパンコーナー等の日用雑貨売場がとても見えづらい 特に１階は何がどこにあるのか分からない 。,サービス・設備,店内レイアウト,"['フライパン', '日用雑貨', '見えづらい', '１階', '分からない']"
レジの男性が親切。,サービス・設備,接客態度,"['レジ', '男性', '親切']"
2.2ミリの太麺パスタを入れて下さい 。,商品,デイリーグッズ,['太麺パスタ']
レジの人が親切で良かったです 。,サービス・設備,接客態度,['親切']
言葉通じない中国人の態度がわるい。,サービス・設備,接客態度,"['中国人', '態度']"
私がたまたま行くドンキは、ややクールな対応の方が多い店舗だと感じます まだ、近くのピアゴ店舗の店員さんは、とても丁寧な接客、特に高齢者に親切なんだと観て思います 。,サービス・設備,接客態度,"['ドンキ', '対応', 'クール', 'ピアゴ', '店員', '丁寧', '接客', '高齢者', '親切']"
一階レジ待ち、10人以上商品詰める場所が狭く待ったアルコール、炭酸一階に置いてほしい 重いから,サービス・設備,レジ処理の速度,"['一階', 'レジ待ち', '商品詰める場所', '狭い', '待った', 'アルコール', '炭酸', '一階', '置いてほしい', '重い', 'くじ', '当たった']"
今迄の駐輪場が駐車場になり、ここに自転車を置かないで下さいのついたてがありますが、かえって駐車場にすると危ないと思います 駐車場と駐車場の間に駐輪場ではなく今まで通り入って右側が駐輪場が良いと思います。,サービス・設備,駐車場,"['駐輪場', '自転車', '危ない']"
過剰接客、自分でやる 支払方法出来ると、言ってるのにやらしてくれ！やらしてくれ！。,サービス・設備,接客態度,"['過剰接客', '支払方法']"
売場の陳列が変わって見やすくなったと思います。,サービス・設備,商品陳列,"['売場', '陳列', '見やすい']"
値段がわからない商品があって、そういうのをなくしていただけたら助かります 。,商品,商品在庫,"['値段', 'わからない']"
前にレジが見習い店員みたいてクレカのmajica番号を読まずに会計されてポイントが付かなかった こちらも初めてクレカ使ったため決済すれば自動に付くと思っていた 今はスマホのmajica番号とクレカをそれぞれ読み込ましている 見習いのレジは指導者がいたほうがよい 。,サービス・設備,レジ処理の速度,"['レジ', '見習い', 'クレカ', 'majica番号', '会計', 'ポイント', 'スマホ']"
レジの方の対応がとても良かったです 。,サービス・設備,接客態度,"['レジ', '対応', '良かった']"
品出しの人がじゃま。,サービス・設備,商品陳列,"['品出し', 'じゃま']"
和泉中央店 今日暑かったですよ!!店内エアコンが切られてたのか、外と温度が同じでした ゆっくり商品を見たいのに汗出てゆっくりなんてしてられませんでした!!季節が進んだからエアコン切るのでは無く、その日の気温に合わせて欲しいです 皆が車で来るのでは無く、３０分以上運動を兼ねて歩いて行く客もいる事を考えてもらいたいです 。,サービス・設備,空調,"['店内エアコン', '温度', '汗', '季節', '気温', '車', '運動', '歩く']"
フンドーキン無添加合わせ味噌ビッグサイズを置いていただきたいです 。,商品,デイリー,"['フンドーキン', '無添加', '合わせ味噌', 'ビッグサイズ']"
時々果物の値段が付いて無い時が有りました。,商品,商品在庫,"['果物', '値段']"
クーポン対象の商品を購入しようと思い探したがなかなか見つからなくて困った 手が届かないような高い場所にあったので購入するのを辞めた クーポン対象の商品は見つかりやすい場所に移動したり、各コーナーでクーポン対象の商品をまとめて置いたりしてみては見つけにくい 。,商品,商品陳列,"['クーポン', '商品', '購入', '見つからない', '高い場所', '辞めた', '見つけにくい']"
レジに並んでいる際、店内チラシを見て、何処かを見ていたが、きちんと声を掛けてくれた 。,サービス・設備,接客態度,"['レジ', '店内チラシ', '声を掛けてくれた']"
私はドンキで買い物をするのが好きです なぜなら、常にプロモーションがあるからです レジの女の子、特にブロンドの髪の女の子が大好きです とても親切。,サービス・設備,接客態度,"['ドンキ', '買い物', 'プロモーション', 'レジ', '女の子', 'ブロンドの髪', '親切']"
食料品の値段を下げて欲しい 期限の近い商品の割引を増やして欲しい。,商品,デイリー,"['食料品', '値段', '下げる', '期限', '近い', '商品', '割引', '増やす']"
レジの対応は良かったです。,サービス・設備,接客態度,"['レジ', '対応', '良かった']"
東洋水産ふっくら中華風おこわ298円を復活させて頂きたい 。,商品,デイリー,"['東洋水産', 'ふっくら中華風おこわ', '復活']"
玉子売り場が2箇所あるので１つにまとめてほしい。,商品,商品陳列,"['玉子売り場', 'まとめて']"
今回のレジをしてくださった方は、以前商品のことを聞いた時も丁寧に対応してくださったので、嬉しく思いました 。,サービス・設備,接客態度,"['レジ', '商品', '聞いた', '丁寧']"
レジの並びが分かりにくかった 。,サービス・設備,レジ処理の速度,"['レジ', '並び', '分かりにくい']"
お弁当がすぐ売り切れるので、もっと在庫を並べてほしい 。,商品,デイリー,"['お弁当', '在庫']"
レジは人によって対応がかなり違いますね 年齢が上の方の方が丁寧な対応ができてると思います ー。,サービス・設備,接客態度,"['レジ', '人', '対応', '年齢', '上の方', '丁寧']"
アリエール除菌プラスが以前945g298円で売っていたが、ココ最近、増量してるのにも関わらず高くなってる 。,商品,ホームグッズ,"['アリエール除菌プラス', '945g', '298円', '増量', '高くなってる']"
クーポンについて、詳しく教えてくれました 。,サービス・設備,商品知識,"['クーポン', '詳しく', '教えて']"
いつも　安いと思います。,サービス・設備,商品価格,['安い']
アイスクリームをもっと安くして欲しい 。,商品,デイリー,"['アイスクリーム', '安く']"
駐車場の割引が2000円以上で1時間は高すぎる また出口も厚木街道に出にくく駐車場の中で渋滞していることがある 。,サービス・設備,駐車場,"['割引', '高すぎる', '出口', '厚木街道', '渋滞']"
リステリン安く提供して欲しいです。,商品,ヘルスケア,"['リステリン', '安く', '提供']"
弁当美味しい。,商品,デイリー,"['弁当', '美味しい']"
日本酒の種類を増やしてほしい 高知のお酒で船中八策を置いてほしいです！。,商品,フード＆ドリンク,"['日本酒', '種類', '高知', 'お酒', '船中八策']"
イワタニのカセットフータフまるを安くして欲しい。,商品,ホームグッズ,"['イワタニ', 'カセットフータフまる', '安く']"
メガネ、ふっくらされている男性ですが、何時も心地良い対応をされます 。,サービス・設備,接客態度,"['メガネ', 'ふっくらされている男性', '心地良い対応']"
安売りの品の所に違う商品が入っていて、間違えて購入しそうになった 気になる商品があったが値段表示がなく購入しなかった。,商品,商品在庫,"['安売り', '品', '違う商品', '購入', '値段表示']"
対応が良かった。,サービス・設備,接客態度,[]
ぞう菜を種類多く，魚売場質をもっとよくして値段ら高くても良いから。,商品,ベジタブル・フルーツ,"['ぞう菜', '種類', '魚売場', '質', '値段']"
16日にペイチャがつかえなかった（15日の深夜だからとのこと）。,サービス・設備,ハンディキャップ対応,"['ペイチャ', 'つかえなかった', '15日', '深夜']"
クーポンの、醤油ラーメン、とんこつラーメン朝10時迄に来店するのですが、毎回欠品ばかり5回以上続いてるので、無いので有ればクーポンに掲載しないで 他の品物でかまんから、在庫確実に有る品物に転換して下さい 至急宜しくです。,商品,欠品,"['クーポン', '醤油ラーメン', 'とんこつラーメン', '来店', '在庫確実']"
混雑時にレジを全部解放して欲しい。,サービス・設備,レジ処理の速度,"['混雑時', 'レジ', '解放']"
いつも、お掃除が行き届いていて、雨の日でも、床が、ピカピカで気持ちが良いですね。,サービス・設備,店内の清潔度,"['お掃除', '行き届いて', '雨の日', '床', 'ピカピカ', '気持ちが良い']"
量販店より、お酒の種類が少ない 。,商品,リカー＆ワイン,"['お酒', '種類', '少ない']"
空いて良かった。,サービス・設備,店内の清潔度,['空いて']
接客があまり良くない みんなちょっと派手すぎる。,サービス・設備,接客態度,"['接客', '派手']"
子供と行く事が多いので、通路がもう少し広かったらなぁと思います 。,サービス・設備,店内レイアウト,"['子供', '通路', '広い']"
この時期で真田、挨拶は、いらないです 。,サービス・設備,接客態度,"['真田', '挨拶']"
生ハムが、198円から238円になってからは買っていません よく行く食品スｰパーと価格が変わらなくなったからです 何故なのでしょうか？。,商品,商品在庫,"['生ハム', '価格', '変わらない']"
レジ対応良 今朝TVでドンキさんの特集を拝見しました さまざまな商品開発、興味深かったです フリーズドライ製法のものが多いようなので、こだわりお茶漬けを作ってみたらいかがでしょうか 。,商品,デイリー,"['レジ対応', '特集', '商品開発', 'フリーズドライ製法', 'お茶漬け']"
いつもきれいに掃除されている。,サービス・設備,店内の清潔度,['掃除']
リステリンは？。,商品,ヘルスケア,['リステリン']
楽しんでお買い物出来ました 。,商品,デイリーグッズ,"['お買い物', '楽しんで']"
小学生をつれて、2000円以上購入したのにゲームコインをもらえない時があったレジの店員によるかもしれないが、統一してほしい。,サービス・設備,レジ処理の速度,"['小学生', '2000円以上', 'ゲームコイン']"
焼肉のタレが美味しかったです 。,商品,フード＆ドリンク,"['焼肉', 'タレ', '美味しい']"
下着を買った時に、男性のレジの方しか、いなくて近くにレジを片付けている女性の方に、声かけて下着なので男性のレジでは、抵抗があると話たら、清算してくれましたとても感じが良かったです。,サービス・設備,接客態度,"['下着', '男性のレジ', '女性のレジ', '声かけ', '清算', '感じが良い']"
レジの手際が良くて待たされる事も無かった。,サービス・設備,レジ処理の速度,"['レジ', '手際', '待たされる']"
レジの人がスムーズで良かった！シャンプーが少し高い気がしますもう少し安くしたらお客さんも買うかも。,サービス・設備,レジ処理の速度,"['スムーズ', '良かった']"
買いたい物の場所がわからない時、従業員さんがいなくて困る。,サービス・設備,接客態度,"['従業員', '困る']"
レジの方は接客的に対応してほしい。,サービス・設備,接客態度,"['レジ', '接客']"
夕方の忙しい時間でしたが、皆さん、テキパキと仕事をしていました 頑張って下さい。,サービス・設備,接客態度,"['忙しい', '時間', 'テキパキ', '仕事', '頑張って']"
即席麺、カップ麺を安くして欲しい‼︎。,商品,デイリーグッズ,"['即席麺', 'カップ麺', '安く']"
武豊店です 1階に少しでも、良いから休憩場所作って下さい～、優しくして下さい。,サービス・設備,店内レイアウト,"['休憩場所', '優しく']"
一部陳列が変わっていました、よかったと思います 他にもあると思います　よろしくお願いします 。,サービス・設備,商品陳列,"['陳列', '変更']"
食品レジにいたSさんの対応がとっても良かったです きちんと目を見て、丁寧に対応してもらえたのが、気持ち良かったです 。,サービス・設備,接客態度,"['Sさん', '対応', '目を見て', '丁寧']"
ピュリナワン。,商品,ペット＆ガーデン,['ピュリナワン']
駐車場入口の警備員さんの態度がデカイ 。,サービス・設備,駐車場,"['警備員', '態度', 'デカイ']"
雨の日に傘が無かった。,商品,カーライフ,"['傘', '雨']"
最近は飲み物が安くない!!前まではドラッグストアより安かったのに最近はドラッグストアの方が安い 。,商品,フード＆ドリンク,"['飲み物', '安くない', 'ドラッグストア']"
値札がついていない商品が積み上げてあり、店員さんに聞いて買いました 数日後に行ってもまだ値札がついていませんでした 。,商品,商品陳列,"['値札', '積み上げ', '店員', '聞く', '買う', '数日後']"
レジでの間違い時に謝罪の言葉なし。,サービス・設備,接客態度,"['レジ', '間違い', '謝罪']"
2.2ミリの太麺パスタを入れて下さい トロピカーナグレープフルーツジュースの小さいバックを入れて下さい 。,商品,デイリー,"['太麺パスタ', 'トロピカーナグレープフルーツジュース']"
朝早かったので、レジに並ぶ人なし レジの人の名前はわからないが、クーポンがちゃんと使われている事を知らせてくれて良いと感じた 。,サービス・設備,接客態度,"['朝早かった', 'レジに並ぶ人なし', 'クーポン', '使われている']"
通路をもっと広くして下さい 。,サービス・設備,店内レイアウト,"['通路', '広く']"
ヤクルト1000増やしてください。,商品,デイリー,"['ヤクルト', '1000']"
支払いをスムーズにする為に、繁忙時は、すべてのレジを解放して欲しい事と宇品店のように店員さんの商品レジスキャンて購入金額が確定したら支払いを顧客自動精算機でできるようにしてもらえればと思います 。,サービス・設備,レジ処理の速度,"['支払い', 'スムーズ', '繁忙時', 'レジ', '解放', '宇品店', '店員', '商品レジスキャン', '購入金額', '支払い', '顧客自動精算機']"
たまごのクーポンが月の後半でなくなるので補充して欲しい。,商品,デイリー,"['たまご', 'クーポン', '補充']"
レジの若い店員の接客態度が悪い。,サービス・設備,接客態度,"['レジ', '若い店員', '悪い']"
レジの方や従業員さんの対応が良かったです また利用したいです！。,サービス・設備,接客態度,"['対応', '良い', '利用']"
日替わりの商品が開店1時間しないのに売り切れは早すぎる 。,商品,商品在庫,"['日替わり', '売り切れ']"
今日もレジ2箇所しか空いてなくて、早く帰宅したいので焦って買い物したに意味なく時間が経つ、なので会社帰りはなるべくドンキーさんは寄らないようにしてます 土日は最悪だと思います 。,サービス・設備,レジ処理の速度,"['レジ', '空いてない', '時間がかかる']"
レジ混みすぎ。,サービス・設備,レジ処理の速度,"['レジ', '混みすぎ']"
アニメコラボしてるグッズの詳細ポスターに売り切れシールが貼られてるのですが、店頭にある商品なのに売り切れシールが貼られてることがあるので、注意してほしいです 。,商品,トイ＆バラエティ,"['アニメコラボ', 'グッズ', '詳細ポスター', '売り切れシール', '店頭']"
業務用ミックスナッツをおいてね!。,商品,デイリー,"['業務用', 'ミックスナッツ']"
洗顔フォームを探したが見つかるまで時間がかかった、しかも種類が少ないドンキホーテの方が種類が多く珍しいタイプがあるメガドンキの方が売り場広いのに、種類が少なく残念。,商品,ホームグッズ,"['洗顔フォーム', 'ドンキホーテ', 'メガドンキ']"
アイスキャンディーの商品を○○入荷して欲しいとレジーの方に頼んだら、すぐメモを取りすぐに対応してくださり次回買い物に行ったら、その商品があり、嬉しかったです ありがとうございました 夏、あの抹茶ミルクキャンディーが食べれて、嬉しかったです 店員さんありがとうございました 。,商品,デイリー,"['アイスキャンディー', '入荷', 'メモ', '対応', '買い物', '抹茶ミルクキャンディー', '店員さん']"
セルフレジがほしい。,サービス・設備,レジ処理の速度,['セルフレジ']
品だしの人、通路狭いので周りみながらやってほしいです ぶつかりました 。,サービス・設備,接客態度,"['品だし', '通路狭い', '周りみながら', 'ぶつかりました']"
欲しかった物が在庫が無かった 棚に物が少なくて、高い所の物が奥まで手を伸ばすのが大変で取りにくい 。,商品,商品在庫,"['在庫', '棚', '手を伸ばす', '取りにくい']"
さつまいもがカットされてたら買います 。,商品,デイリー,"['さつまいも', 'カット']"
丁寧に接客していただいたので何も言うことはありません 。,サービス・設備,接客態度,[]
対応は、人による 今日の対応は、もう少し丁寧にしても良かったと思う あまり気分は良くない 。,サービス・設備,接客態度,"['対応', '丁寧']"
野菜も置いて頂けると助かります 。,商品,ベジタブル・フルーツ,['野菜']
いつも楽しくて安くていくのがたのしみです！。,サービス・設備,商品価格,"['楽しい', '安い']"
大人のおしめを探したのですが、見当たらなくて、諦めました 少しでも置いてもらえると有り難いです 。,商品,ヘルスケア,['大人のおしめ']
レジで商品をかごに移す際 商品の扱いが雑でした 駐輪場にカートがいくつもあって 道を塞いでいた 。,サービス・設備,レジ処理の速度,"['商品', '扱い', '雑', '駐輪場', 'カート', '道', '塞いでいた']"
9月の特売品がたくさん有って良かったです!。,商品,商品在庫,"['特売品', '9月']"
