comment,category,tag,keywords
店員さんがコスプレ？(⁠カチューシャ⁠)していて可愛かった 対応も丁寧でした 。,サービス・設備,接客態度,"['店員さん', 'コスプレ', 'カチューシャ', '可愛い', '対応', '丁寧']"
なんでも安くてよく利用するが、夜遅く買い物に行った際、従業員数が少ないのかもしれないが通路に空き段ボールが放置していて整理されていない感じがした そこで作業中なら仕方ないが従業員はそばにいなかったのが残念であった！。,サービス・設備,店内の清潔度,"['従業員数', '通路', '段ボール', '整理']"
愛知県稲沢市のドンキホーテ稲沢東店でほぼ買い物をしているのですが朝から食品レジにいる「X」さんという店員さんの態度がいつも気になりますこちらがドリンクは倒して入れてください等、話しかけても完全無視です！相槌もうたずの無視ですもう少し研修するなり、お客に対しての対応に気を遣っていただきたいです。,サービス・設備,接客態度,"['ドンキホーテ', '稲沢東店', '買い物', '食品レジ', 'Xさん', '態度', '気になる', '話しかけ', '無視', '研修', '対応']"
トイレットペーパー安くして欲しい 。,商品,デイリー,"['トイレットペーパー', '安く']"
Tがとにかく溜口でなれなれしい,サービス・設備,接客態度,"['溜口', 'なれなれしい']"
クーポン発券機を直してほしいです 。,サービス・設備,その他設備,"['クーポン発券機', '直してほしい']"
今日は入口にお茶の箱売りがあり、購入しました たくさんありました ついでにきのこの里も安かったので買いました 。,商品,デイリー,"['お茶', '箱売り', 'きのこの里']"
レジの対応はいつも丁寧です 。,サービス・設備,接客態度,"['レジ', '対応', '丁寧']"
また、フライパンの、安売りをして下さい。,商品,ホームグッズ,"['フライパン', '安売り']"
品揃えが良かった。,商品,商品陳列,"['品揃え', '良かった']"
レジの待ち時間を減らして欲しい！家電やジュニア服を増やして欲しい！お寿司やお弁当等もとても美味しく好きです オリジナルデザートがたくさんあったらいいなぁ 勝幡のサービスカウンターでお中元を送る時に対応してくれた女性がとても詳しく的確、迅速な対応で旦那と笑顔で帰宅しました^_^その時はありがとうございました 。,サービス・設備,商品陳列,"['レジ', '待ち時間', '家電', 'ジュニア服', 'お寿司', 'お弁当', 'オリジナルデザート', '勝幡', 'サービスカウンター', 'お中元', '対応', '女性', '詳しく的確', '迅速', '笑顔', '帰宅', 'ありがとうございました']"
以前より高くなっている 。,商品,商品知識,['高くなっている']
携帯で、クーポンを探すのが大変。,サービス・設備,割引サービス,"['携帯', 'クーポン', '探す']"
優しい定員さんばかりで買い物してて楽しい買い物になります。,サービス・設備,接客態度,"['優しい', '定員さん', '買い物', '楽しい']"
みんなが驚くような商品価格でたまには、売ってください 。何が驚安商品なのか。,商品,商品知識,"['驚安商品', '商品価格']"
値段も安く、ドンキブランドの商品も大好きです！。,商品,商品価格,"['値段', '安い', 'ドンキブランド']"
レジのいとうさんとても感じも対応も良かったです。,サービス・設備,接客態度,"['レジ', 'いとうさん', '感じ', '対応', '良かった']"
2.2ミリの太麺パスタを入れて下さい 。,商品,デイリーグッズ,['太麺パスタ']
名前を見そびれましたが、レジの方の対応は良かったです 。,サービス・設備,接客態度,"['レジ', '対応', '良かった']"
ヨーグルトの種類を増やしてほしいです！！。,商品,デイリー,"['ヨーグルト', '種類', '増やす']"
地下に降りる階段のセールスが毎回毎回うざい。,サービス・設備,接客態度,"['階段', 'セールス', 'うざい']"
いつもペットボトルのお茶をケース購入します １０月には値上げになるので駆け込み購入者が増えると思うので在庫の強化をお願いします 。,商品,デイリー,"['ペットボトル', 'お茶', 'ケース購入', '値上げ', '在庫', '強化']"
欲しい商品が売り切れていた、すぐ補充して欲しい。,商品,商品在庫,"['売り切れ', '補充']"
レジで親切にマジカの事を教えてくださいました 。,サービス・設備,接客態度,"['レジ', '親切', 'マジカ']"
道路が混んでいて入りにくかった。,サービス・設備,駐車場,"['道路', '混んでいる', '入りにくい']"
毎回レシートが長くてクイックペイが嫌いになりそうです。,サービス・設備,レジ処理の速度,"['レシート', 'クイックペイ']"
人によって違うので、駄目な態度の人も確かにいるし、ちゃんと対応される方もおられるので、一概には言えない 。,サービス・設備,接客態度,"['態度', '対応']"
サイトウの名前の人のレジで会計をしたが、袋が必要ですか、会計６番です しか言われなかった 接客できる人のレジを通ってると、すごく目立つ 。,サービス・設備,接客態度,"['サイトウ', '名前', 'レジ', '会計', '袋', '会計６番', '接客', '目立つ']"
我が家の在庫がすぐ無くなるので、ギャッツビーの洗顔をいつでも安くしてほしいです 。,商品,スキンケア,"['ギャッツビー', '洗顔']"
レジの方が早口で何度も聞き返してしまいましたすみませんでした。,サービス・設備,接客態度,"['レジ', '早口', '聞き返し']"
袋詰めまでしていただき、有り難かった 。,サービス・設備,接客態度,"['袋詰め', '有り難い']"
入店時レジは空いていましたが、「いらっしゃいませ」はありませんでした 。,サービス・設備,接客態度,"['入店時', 'レジ', '空いていました', 'いらっしゃいませ']"
1階のレジを複数にしてほしいです 食品を少し購入するだけで長い列に並ぶのは嫌です 。,サービス・設備,レジ処理の速度,"['1階', 'レジ', '複数', '食品', '列', '並ぶ']"
店員は良かったけど、くじの意味有りますか？アンケートを取るだけの当たりの無いくじでは？仕事場は2000人近くいますが、当たった人は聞いた事無いです 。,サービス・設備,その他サービス,"['くじ', '当たり']"
サービスカウンターにベルがなく 何度かウロウロしながら反対側にベルが故障しています の張り紙が どちら側にも貼っていてほしかったです 。,サービス・設備,接客態度,"['サービスカウンター', 'ベル', '故障', '張り紙']"
スタッフの皆さんがキビキビと働いていて、いつ行っても気持ちが良いです！！。,サービス・設備,接客態度,"['スタッフ', '働いている', '気持ちが良い']"
いい店。,サービス・設備,接客態度,"['いい', '店']"
言葉使いが良かった。,サービス・設備,接客態度,"['言葉使い', '良かった']"
野菜があまり新鮮ではない椎茸も並んでる時点で既に赤っぽかったり　。,商品,ベジタブル・フルーツ,"['野菜', '新鮮', '椎茸']"
今日は食品類あまり特に安くワクワクする商品が無かったです。,商品,デイリー,"['食品', '安い']"
クーポン取得したが品切れだった騙された気分。,商品,欠品,"['クーポン', '品切れ', '騙された']"
店員の対応が良かった。,サービス・設備,接客態度,[]
入口の買い物かご、高く積まれいてチビの私にはとりにくかった 。,サービス・設備,商品陳列,"['買い物かご', '高く積まれて', 'チビ']"
PayPayが使えないなら使えないってレジとかに表示しておいて欲しいです。,サービス・設備,レジ処理の速度,"['PayPay', '使えない', '表示']"
伊勢市のごみ袋、少し高いかなと思います 。,商品,デイリー,"['伊勢市', 'ごみ袋', '高い']"
レジの改善。,サービス・設備,レジ処理の速度,['改善']
Calbeeのポテトチップスのセールをお願いします!!ドラッグストアよりドンキが安いのは知ってますが、もう少しだけで良いので値下げをお願いしますm(_ _)m。,商品,デイリー,"['Calbee', 'ポテトチップス', 'セール', '値下げ']"
キャラパキ安くしてほしい キャンペーン葉書をおいてほしい 。,商品,トイ＆バラエティ,"['キャラパキ', '安く', 'キャンペーン葉書']"
飲み物売り場で買いたかったUccのブラックコーヒー無糖がまた売り切れてました たびたびあるんですがどうにかしてください 。,商品,フード＆ドリンク,"['Ucc', 'ブラックコーヒー', '無糖']"
トマトを安くして欲しい。,商品,デイリー,"['トマト', '安く']"
食料品を安くして欲しい。,商品,デイリー,"['食料品', '安く']"
トラベル用のシャンプーセットなどを置いて欲しい 。,サービス・設備,ホームグッズ,"['トラベル', 'シャンプーセット']"
クーポンサービスわかりにくい,サービス・設備,割引サービス,"['クーポンサービス', 'わかりにくい']"
アプリ　アップデートしたら、異常に使いづらい 元のほうがよかった！！。,サービス・設備,商品知識,"['アプリ', 'アップデート', '使いづらい', '元のほうがよかった']"
着圧の安いストッキングがあると嬉しいです 。,商品,ファッション＆カバン,"['着圧', '安い', 'ストッキング']"
h&sのシャンプーとコンディショナーを安くして欲しいです。,商品,ヘルスケア,"['シャンプー', 'コンディショナー', '安く']"
手ぶら便の対応が悪い 効率が悪くモタモタしている 。,サービス・設備,ホームグッズ,"['手ぶら便', '対応', '効率', 'モタモタ']"
スムーズで対応も良かったです 。,サービス・設備,接客態度,"['スムーズ', '対応', '良かった']"
覚えたら棚変え‼️覚えたら棚変え‼️。,商品,商品陳列,['棚変え']
サラダチキンと燻麦値段戻して下さい。,商品,デイリー,"['サラダチキン', '燻麦', '値段']"
　　レジの方の対応がとても良かったです 。,サービス・設備,接客態度,"['レジ', '対応', '良かった']"
欲しい食品の商品が店内すぐ入ってあって買い物しやすかった！。,商品,商品在庫,"['食品', '商品', '店内', '買い物']"
外国人のスタッフの方が丁寧に対応してくださりました 。,サービス・設備,接客態度,"['外国人', 'スタッフ', '丁寧']"
レジ係のIさんに親切に対応して頂きました ありがとうございます 。,サービス・設備,接客態度,"['レジ係', 'Iさん', '親切', '対応']"
通路が狭い 高い処の商品が取りにくい 。分かりにくい,サービス・設備,店内レイアウト,"['通路', '狭い', '高い', '取りにくい', '分かりにくい']"
よくドンキに行きますが野菜、果物は購入する気持ちになれません!。,商品,ベジタブル・フルーツ,"['野菜', '果物']"
リンゴのバラ売りと袋とが違う場所にあり、バラ売りが欲しかったのに諦めそうになりました 同じ物はまとめてもらえると探しやすいです 。,商品,商品陳列,"['リンゴ', 'バラ売り', '袋']"
ビジネスシューズが増えました 。,商品,ファッション＆カバン,"['ビジネスシューズ', '増えました']"
いつもお値打ち商品ありがとうございます❗今回　いかげそ　がなくて購入出来ませんでした また　納入しておいて下さいませ 。,商品,商品在庫,"['いかげそ', '購入']"
大きい子供用のオモチャを持てる限り持って並んでいました 順番がきたのでマジカカード提出後、買い物袋を下さいと言うと、カートを使ってないのでと断られました 目の前にあるカートに入れて並び直して下さいと わざわざ持てる限り持って並んでるのに嫌がらせとしか思えませんね 他のお客の前で晒された気分でした あの店員さんには不満しかないです その後、一階で食品を買ってレジに並ぶとまたその店員さんがいました カード支払いが終わると一品だけレジを打ち忘れたと言われ結局一品だけ現金で購入しました 不愉快極まりない。,サービス・設備,接客態度,"['オモチャ', 'カート', '買い物袋', 'マジカカード', 'レジ', '食品', '現金']"
牛脂の場所がよくわからなかった ステーキ肉の近くにあると嬉しいです 。,商品,デイリー,"['牛脂', 'ステーキ肉']"
駐輪場が狭いです。,サービス・設備,駐車場,"['駐輪場', '狭い']"
インスタラーメンをもっと安くしてほしい 一人暮らしの男性には必需品です 。,商品,デイリーグッズ,"['インスタントラーメン', '安く']"
レジが混まないように…。,サービス・設備,レジ処理の速度,['混まない']
重たい荷物(お米)を前の机まで運んでもらえてとても助かりました。,サービス・設備,店内レイアウト,"['重たい荷物', 'お米', '前の机', '運ぶ']"
9月15日午後3時頃来店 品出ししてる従業員、商品を取りたいのに台車をどかしてくれず目が合ったにも関わらず黙々と作業を続けた どこもかしこも商品棚の前に段ボールの山 棚に並んでる商品取れない 人手不足なら手が回らない段ボールはバックヤードに置いておくべきでは？。,サービス・設備,商品陳列,"['品出し', '台車', '目が合った', '作業', '商品棚', '段ボール', '人手不足', 'バックヤード']"
レジのMさんはとても親切です 私のお気に入り,サービス・設備,接客態度,['親切']
ヘアカラーの下の棚が埃っぽかったです 。,サービス・設備,店内の清潔度,"['ヘアカラー', '下の棚', '埃']"
クーポン取得する際、カテゴリーわけがされてないので、探す事が面倒くさいです クーポンを探す時間も短縮したいので、これからはあまり、利用しないと思います 高齢の母は普段から、食品系と生活雑貨系の購入がおもですので、ますますドンキホーテの利用は少なくなると思います 画面が急に変わった事により少しパニックになっていたので 未だにドンキホーテで買物した事を、ピアゴで買物して来た と、話すので笑。,サービス・設備,割引サービス,"['クーポン', 'カテゴリー', '探す', '時間短縮', '利用しない', '高齢の母', '食品', '生活雑貨', 'ドンキホーテ', '画面', 'パニック', 'ピアゴ', '買物']"
このくじがもう1年以上当たってないけど、どんな確率なんでしょうかね?!。,サービス・設備,その他サービス,"['くじ', '当たる', '確率']"
レジがすいていた為、袋に入れて下さって助かりました 袋が無料も有難い 。,サービス・設備,レジ処理の速度,"['レジ', '袋', '無料']"
30MS 30MMは、人気があるプラモなので少数で良いので入れて欲しい特に本体よりもオプションパーツ類また　プラモ系を取り扱っている店舗の情報をSNSで表示してほしい。,商品,トイ＆バラエティ,"['プラモ', 'オプションパーツ', '店舗', 'SNS']"
野菜類がもう少し安くなるようになれば良いのですが。,商品,ベジタブル・フルーツ,['安くなる']
平日なのかレジは二つしか開いてなくて凄い行列でレジ待ちしてました 頭に来てので近くの従業員に話したらすぐレジを開けてくれました レジの人は並んでる人を見て応援を頼まないのですか？教育がなってないっておも。,サービス・設備,レジ処理の速度,"['平日', 'レジ', '行列', '待ち', '従業員', '応援', '教育']"
混んでいても、空いてるレジに誘導してくれて、前に置いていた商品が見当たらなく、店員さんに、聴くと、端末で在庫などを確認してくれて、親切丁寧な対応をしてくださいました 季節の移り代わりの商品などわかりやすく、値下げ品も満足して買えます 。,サービス・設備,レジ処理の速度,"['混んでいる', '空いている', '誘導', '商品', '在庫', '親切', '丁寧', '季節の移り変わり', '値下げ品']"
希望している商品があったりなかったりして定期的に続けて購入が出来ず困る 安定して入荷してほしい 。,商品,商品在庫,"['希望', '商品', '定期的', '購入', '入荷']"
買い物しやすかった。,サービス・設備,店内レイアウト,"['買い物', 'しやすかった']"
会計中のチャージ？が面倒で1度お断りしましたが、簡潔･丁寧に説明して操作してくれた若い女性レジの方、ホント印象良かったです ありがとうございました 。,サービス・設備,接客態度,"['会計中', 'チャージ', 'お断り', '説明', '操作', '若い女性レジ', '印象良い']"
冷凍食品を購入したがドライアイスが必要か声掛けが無かった後から請求した。,商品,デイリー,"['冷凍食品', 'ドライアイス', '声掛け', '請求']"
レジが混んでる 。,サービス・設備,レジ処理の速度,['混んでる']
場所がわからないので店員に聞きたいのに、店員がいない そのくせ、3人くらいでいつもおしゃべりしてる。,サービス・設備,接客態度,"['場所', '店員', '聞きたい', 'いない', 'おしゃべり']"
あれだけのスタッフがいるにも関わらず、品出しと在庫管理が出来てないと思った 昨日買わずに帰ってしまった商品を探したら、品出しされてた分は売れたようで棚にはありませんでした 聞けば持ってきてくれたのかもしれないけど、あまり人と話すのは苦手なのであきらめました あと、使い捨てのスプーンを探してたのですが、昨日からなくて今日もありませんでした くまなく確認してるのか、疑わしいです ないなら売切れですとか、補充してませんとか、客が見てわかるような表示をした方がいいと思います 数年前は、クーポン対象商品が売れてしまってないということもありました 。,サービス・設備,商品在庫,"['スタッフ', '品出し', '在庫管理', '商品', '棚', '話す', '使い捨てのスプーン', '確認', '売切れ', '補充', '表示', 'クーポン対象商品']"
探さなかったクーポン利用予定だった商品をレジで声掛けしていただき、持ってきていただきました ありがとうございました 。,サービス・設備,割引サービス,"['クーポン', '利用予定', '商品', 'レジ', '声掛け', '持ってくる', 'ありがとう']"
冷凍食品用のドライアイスが欲しい ドンペンのUFOキャッチャーがぜんぜん取れない 。,商品,デイリーグッズ,"['冷凍食品', 'ドライアイス', 'ドンペン', 'UFOキャッチャー']"
夏場の便座の温度はもっと下げて欲しい 。,サービス・設備,ハンディキャップ対応,"['便座', '温度', '夏場']"
間違えの多い人でした レジを打っている時に間違えを１つ見つけましたが、帰ってきてから家で見直したら、もう一つ、2個しか買ってないものが3個に打たれてました 忙しかったので、そのままにしてしまいましたが、せっかく安いものを買ったのに残念です 。,サービス・設備,接客態度,"['間違え', 'レジ', '買った', '安いもの']"
忙しいか、コロナウイルスか余り、声かけは有りません お客さまの籠から袋が落ちて、レジの補佐の人がその袋を誤って踏みそのままお客さまの籠に返してました 商品を取り変えた方が良かったのではないかな。,サービス・設備,接客態度,"['忙しい', 'コロナウイルス', '声かけ', '袋', 'レジ', '補佐', '踏む', '籠', '商品', '取り変える']"
食料品、特に冷凍食品を増やしてほしい。,商品,デイリー,"['食料品', '冷凍食品']"
お客が従業員の近くを通っても、またお客の姿を見ても、「いらっしゃいませ」の言葉が無かった 接客用語が出来きていなかった 。,サービス・設備,接客態度,"['いらっしゃいませ', '接客用語']"
Sさんの対応が丁寧でとても良かったです。,サービス・設備,接客態度,"['Sさん', '対応', '丁寧', '良かった']"
お菓子の驚安のものが以前より凄く少なくなった気がします 。,商品,菓子・珍味,"['驚安', '少ない']"
アイスクリームをかったので、ドライアイスを、聞いて頂き、解けずに持ち帰ることが出来、助かりましたありがとございます 　ちんすこう見つけてラッキー。,商品,デイリー,"['アイスクリーム', 'ドライアイス', 'ちんすこう']"
レジの手際が良くスムーズに会計処理が終わった。,サービス・設備,レジ処理の速度,"['手際', 'スムーズ', '会計処理']"
レジ担当の方が、すごくいい方だった 。,サービス・設備,接客態度,"['レジ担当', 'いい方']"
銀座店のサッカー台にゴミ箱を設置してほしいです よろしくお願いします 。,サービス・設備,店内レイアウト,"['銀座店', 'サッカー台', 'ゴミ箱', '設置']"
いつもらっきょうの甘酢漬けが品切れしてるので、たくさん入れて欲しい 。,商品,デリカ,"['らっきょう', '甘酢漬け', '品切れ']"
駐車場の入り口の警備員さんの対応が悪く、非常に気分が悪かった。改善してほしい。,サービス・設備,駐車場,"['警備員', '対応', '改善']"
野菜を多く仕入れてください 。,商品,ベジタブル・フルーツ,"['野菜', '仕入れ']"
箸を着けるか聞いてくれた。,サービス・設備,接客態度,['箸']
問い合わせに対して、その商品はまだ入荷していないとのことでしたが、以前あったから聞いてみたのに入荷指定なしていないの意味がわからなかった 笑顔も見うけられない 無愛想だった 。,サービス・設備,接客態度,"['入荷', '入荷指定', '意味', '笑顔', '無愛想']"
箸を着けるか聞いて欲しい。必要だったのに入っていなかった,サービス・設備,店内の清潔度,"['箸', '着ける', '入っていなかった']"
食品もっと安くして。,商品,デイリー,"['食品', '安く']"
ペットボトル飲料が高い。,商品,デイリー,"['ペットボトル', '飲料', '高い']"
女性の店員さんのレジの対応がとても良いです 。,サービス・設備,接客態度,"['女性', '店員', 'レジ', '対応', '良い']"
majica払いを丁寧に教えてくれスムーズに会計ができました 期日が迫っているポイントもありそれから利用してと教えていただきポイントも捨てずに済みました ちなみにキャンペーンの300ポイントでした 。,サービス・設備,レジ処理の速度,"['majica払い', '会計', 'ポイント', 'キャンペーン']"
通路に品物がいっぱい通れない。,サービス・設備,商品陳列,"['通路', '品物', '通れない']"
入口付近が、狭い よく、エスカレーターが、停まってる改善を！。,サービス・設備,店内レイアウト,"['入口', '狭い', 'エスカレーター', '停まってる', '改善']"
みなさん丁寧に対応してくれました 。,サービス・設備,接客態度,"['丁寧', '対応']"
お名前は覚えておりませんが、新人さんマークが付いた方でしたが、対応が良くスムーズでした 。,サービス・設備,接客態度,"['新人', '対応', 'スムーズ']"
レジに行列ができていた中、会計レジのトラブル？でレジに入っていた店の人がいなかった でもちょっとしたら他のレジが開き始めたからよかった。,サービス・設備,レジ処理の速度,"['行列', 'トラブル', '店の人', '開き始めた']"
気持ちの良い対応でした。,サービス・設備,接客態度,"['気持ちの良い', '対応']"
カートに会計済のかごをのせてくださいました 重いかごだったのでたすかりました 。,サービス・設備,レジ処理の速度,"['カート', '会計済', 'かご', '重い']"
